"https://www.immoscout24.ch/kaufen/4002782802","https://cdn.immoscout24.ch/listings/v2/d585/4002782802/image/f3ef146c1104f81f7b4ab646a3b6195b.jpg","https://cdn.immoscout24.ch/listings/v2/d585/4002782802/image/f3ef146c1104f81f7b4ab646a3b6195b.jpg","","","data:image/gif;base64,R0lGODlhAQABAIAAAAAAAP///yH5BAEAAAAALAAAAAABAAEAAAIBRAA7","data:image/gif;base64,R0lGODlhAQABAIAAAAAAAP///yH5BAEAAAAALAAAAAABAAEAAAIBRAA7","","data:image/gif;base64,R0lGODlhAQABAIAAAAAAAP///yH5BAEAAAAALAAAAAABAAEAAAIBRAA7","1 / 13","https://cdn.immoscout24.ch/f_auto/t_listing_card_117x102/listings/v2/d585/4002782802/image/788f37d3d46564e5c54eb686f43cfdbb.jpg","https://cdn.immoscout24.ch/f_auto/t_listing_card_117x102/listings/v2/d585/4002782802/image/7de55262cd9e48f772b3e63638d0b30e.jpg","https://cdn.immoscout24.ch/f_auto/t_listing_card_117x102/listings/v2/d585/4002782802/image/26f8b7b3f67b6f99aaffb38090afa9f1.jpg","Parkplatz","Balkon / Terrasse","Aussicht","+3","3.5 Zimmer","83m²","CHF 465’000.–","Route de Grône 60, 3966 Réchy","Die Arbeiten haben begonnen!","VERKAUF AUF PLÄNELieferung: Ende Dezember 2026Kleines Gebäude mit 7 Wohnungen auf 3 EbenenWOHNUNGSTYPEN- 1x 4,5 Zimmer- 6x 3,5 ZimmerAUSSTATTUNG DER WOHNUNG - Eingangshalle- Ausgestattete offene Küche zum Wohnbereich- 2 Schlafzimmer- 1 Dusche mit Dusche, WC und Waschbecken- 1 Badezimmer mit Badewanne, WC und Waschbecken- Balkon von 15m2MERKMALE- Top-Lage- Bau nach den geltenden SIA-Normen- Äußere Wärmedämmung nach Energiebilanz- Wärme- und Schalldämmung- Heizung durch Luft/Wasser-Wärmepumpe- Photovoltaik-Solarmodule- Kühleinschub auf der Wärmepumpe- Fußbodenheizung- Warmwassererzeugung: Boiler in Verbindung mit der Wärmepumpe- 1 Stromverteilerkasten pro Wohnung- Anschlüsse für Waschmaschinen in jeder Wohnung- Dreifachverglasung- Schiebetüren mit Hebevorrichtung- Aufzug nach Procap-Norm- 1 Keller pro Wohnung- Fertigstellung nach Wunsch des Käufers- Vollständige Beschreibung auf AnfragePARKPLÄTZE- 2 Außenparkplätze zu CHF 15'000/pro Platz (zusätzlich und obligatorisch)AUSSTATTUNG- Ruhige und friedliche Lage.- Nähe zum Ortszentrum und den Geschäften- 3 Minuten mit dem Auto von der Autobahn entfernt- 5 Minuten zu Fuß vom Seilbahn und der Schule entferntZögern Sie nicht, die Liste der verfügbaren Grundstücke zu konsultieren.Informationen und Terminvereinbarung: Cyril +41 79 464 11 35***Alle unsere Immobilien sind auf www.berra-immobilier.ch verfügbar***","https://cdn.immoscout24.ch/t_customer_logo/logos/l_d585_v1.jpg","> 60 min","Station: Sierre","data:image/gif;base64,R0lGODlhAQABAIAAAAAAAP///yH5BAEAAAAALAAAAAABAAEAAAIBRAA7","data:image/gif;base64,R0lGODlhAQABAIAAAAAAAP///yH5BAEAAAAALAAAAAABAAEAAAIBRAA7","data:image/gif;base64,R0lGODlhAQABAIAAAAAAAP///yH5BAEAAAAALAAAAAABAAEAAAIBRAA7","data:image/gif;base64,R0lGODlhAQABAIAAAAAAAP///yH5BAEAAAAALAAAAAABAAEAAAIBRAA7","https://media.homegate.ch/agentAvatar/a_d585_C_Bieckens_v1.jpeg","Cyril Bieckens","Agent Immobilier","data:image/gif;base64,R0lGODlhAQABAIAAAAAAAP///yH5BAEAAAAALAAAAAABAAEAAAIBRAA7"
"https://www.immoscout24.ch/kaufen/4002782798","https://cdn.immoscout24.ch/listings/v2/d585/4002782798/image/28fcad31698bca6f3d8fab5b6bdca87e.jpg","https://cdn.immoscout24.ch/listings/v2/d585/4002782798/image/28fcad31698bca6f3d8fab5b6bdca87e.jpg","","","data:image/gif;base64,R0lGODlhAQABAIAAAAAAAP///yH5BAEAAAAALAAAAAABAAEAAAIBRAA7","data:image/gif;base64,R0lGODlhAQABAIAAAAAAAP///yH5BAEAAAAALAAAAAABAAEAAAIBRAA7","","data:image/gif;base64,R0lGODlhAQABAIAAAAAAAP///yH5BAEAAAAALAAAAAABAAEAAAIBRAA7","1 / 13","https://cdn.immoscout24.ch/f_auto/t_listing_card_117x102/listings/v2/d585/4002782798/image/1a7f29fd30ffeb74a5d3dba957d81dbb.jpg","https://cdn.immoscout24.ch/f_auto/t_listing_card_117x102/listings/v2/d585/4002782798/image/1a8f692b2c9d429f827c034213eabb9a.jpg","https://cdn.immoscout24.ch/f_auto/t_listing_card_117x102/listings/v2/d585/4002782798/image/286f5cd3dfeb7d1e7037a6f7f939079e.jpg","Garage","Aussicht","","","4.5 Zimmer","145m²","CHF 755’000.–","Rue des Bouchia 12, 3966 Chalais","Verkaufsförderung in Chalais","Baugenehmigung ist eingetroffen !!Baubeginn im April 2026Verkauf nach Plan Projekt von 2 Reihenhäusern mit 145m2Traditionelle Bauweise mit Peripherisolation und Flachdächern.Ideal für eine Familie, profitiert dieses Objekt von einer ruhigen Umgebung mit Geschäften, Schulen und Gesundheitsdiensten in der Nähe. Die Seilbahn Chalais-Vercorin und die Bushaltestellen bieten eine hervorragende Verbindung zu den Bergfreizeitaktivitäten und den benachbarten Städten.HÖHEPUNKTE-Großer Wohn-/Kochbereich im EG, Zugang zur Terrasse/Garten, Südausrichtung-Schlafzimmer im Obergeschoss + Ankleide und Bürobereich-2 Badezimmer mit Dusche und Badewanne-Heizung durch Wärmepumpe, Fußbodenheizung (Komfort &amp; Ersparnisse)-PVC-Fenster mit Doppelverglasung und Isolierung-Flachdach isoliert und abgedichtet-Innenausstattung nach Wunsch des KäufersINNENAUSSTATTUNG MODULIERBAREG: -Eingang mit Einbauschränken-Voll ausgestattete Küche, offene Verbindung zum Ess-/Wohnbereich mit Zugang zum Garten-Badezimmer mit Waschmaschine-AbstellraumObergeschoss: -3 Schlafzimmer, davon eines mit Ankleide-Badezimmer mit Fenster-Offener Bereich für BüroAUßENBEREICH &amp; PARKPLÄTZETerrasse und Garten nach PlanGrundausstattung und Asphaltierung durch die Verkaufsförderung vorgesehenAußensteckdose und Wasserhahn3 halb überdachte Parkplätze im Kaufpreis enthaltenVERKEHRSANBINDUNG-Geschäfte des täglichen Bedarfs (Bäckerei, Metzger, Apotheke, Bank usw.)-Schulen, Mediathek und lokale Vereine-Medizinische und paramedizinische Dienste in der GemeindeFREIZEIT-Viele Familienwanderungen (Bisse de Ricard, Vallon de Réchy)-Schneller Zugang zu den Bergaktivitäten und dem Skigebiet Vercorin (Ski, Minigolf, Kletterwald)-Lokales Kulturerbe (Tour de Chalais, Bildungsbauernhöfe)-Dorfgasthöfe und CafésVERKEHRo Seilbahn Chalais-Vercorin: verbindet die Ebene mit dem Skigebiet in 7 Minuten.o Regionale Busse CarPostal: bedienen Chalais und die umliegenden Orte (Sierre, Réchy, Vercorin).o Bahnhof Sierre: in etwa 10 Minuten mit dem Auto oder Bus erreichbar, mit direkten Verbindungen nach Lausanne, Genf und dem Oberwallis.o Straßenanbindung: nahe der Autobahnabfahrt A9 (Sierre-West), erleichtert die Fahrt mit dem Auto.Verkaufsprospekt nur auf Anfrage !Bei uns ist Neugier ein schöner Fehler, also zögern Sie nicht, uns anzurufen, um mehr Informationen zu erhalten oder einen Besuch vor Ort zu machen !Kontakt: Cyril 0794641135Alle unsere Objekte auf berra-immobilier.ch !!!","https://cdn.immoscout24.ch/t_customer_logo/logos/l_d585_v1.jpg","-","","data:image/gif;base64,R0lGODlhAQABAIAAAAAAAP///yH5BAEAAAAALAAAAAABAAEAAAIBRAA7","data:image/gif;base64,R0lGODlhAQABAIAAAAAAAP///yH5BAEAAAAALAAAAAABAAEAAAIBRAA7","data:image/gif;base64,R0lGODlhAQABAIAAAAAAAP///yH5BAEAAAAALAAAAAABAAEAAAIBRAA7","data:image/gif;base64,R0lGODlhAQABAIAAAAAAAP///yH5BAEAAAAALAAAAAABAAEAAAIBRAA7","https://media.homegate.ch/agentAvatar/a_d585_C_Bieckens_v1.jpeg","Cyril Bieckens","Agent Immobilier","data:image/gif;base64,R0lGODlhAQABAIAAAAAAAP///yH5BAEAAAAALAAAAAABAAEAAAIBRAA7"
"https://www.immoscout24.ch/kaufen/4002782797","https://cdn.immoscout24.ch/listings/v2/d585/4002782797/image/85515e26e7d4b5ad5af84e06785a8e8a.jpg","https://cdn.immoscout24.ch/listings/v2/d585/4002782797/image/59b4ed7e2152b18bd288665ec662a164.jpg","https://cdn.immoscout24.ch/listings/v2/d585/4002782797/image/c1ad61feb49cc1d8a799b81f92dfc8d3.jpg","https://cdn.immoscout24.ch/listings/v2/d585/4002782797/image/559227d57003280bd685552ba83d4273.jpg","data:image/gif;base64,R0lGODlhAQABAIAAAAAAAP///yH5BAEAAAAALAAAAAABAAEAAAIBRAA7","data:image/gif;base64,R0lGODlhAQABAIAAAAAAAP///yH5BAEAAAAALAAAAAABAAEAAAIBRAA7","https://cdn.immoscout24.ch/listings/v2/d585/4002782797/image/85515e26e7d4b5ad5af84e06785a8e8a.jpg","data:image/gif;base64,R0lGODlhAQABAIAAAAAAAP///yH5BAEAAAAALAAAAAABAAEAAAIBRAA7","4 / 13","https://cdn.immoscout24.ch/f_auto/t_listing_card_117x102/listings/v2/d585/4002782797/image/59b4ed7e2152b18bd288665ec662a164.jpg","https://cdn.immoscout24.ch/f_auto/t_listing_card_117x102/listings/v2/d585/4002782797/image/c1ad61feb49cc1d8a799b81f92dfc8d3.jpg","https://cdn.immoscout24.ch/f_auto/t_listing_card_117x102/listings/v2/d585/4002782797/image/559227d57003280bd685552ba83d4273.jpg","Garage","Aussicht","","","4.5 Zimmer","145m²","CHF 770’000.–","Rue des Bouchia 12, 3966 Chalais","Verkaufsförderung in Chalais","Vente auf Plan Projekt von 2 Reihenhäusern mit 145m2Traditioneller Bau mit Peripherisolation und flachen Dächern. Genehmigung in Bearbeitung (günstige Vorabzusage) - Endgültige Genehmigung vor Ende 2025Baubeginn nach Erhalt der Baugenehmigung: Bauzeit ca. 14 Monate ab Erdgeschoss.Ideal für eine Familie, profitiert dieses Objekt von einer ruhigen Umgebung mit Geschäften, Schulen und Gesundheitsdiensten in der Nähe. Die Seilbahn Chalais-Vercorin und die Bushaltestellen bieten eine hervorragende Verbindung zu den Bergfreizeitaktivitäten und den benachbarten Städten.HÖHEPUNKTEoGroßer, heller Wohn-/Kochbereich im Erdgeschoss, Zugang zur Terrasse/Garten, Südausrichtungo3 Schlafzimmer im Obergeschoss + Ankleide und Arbeitsbereicho2 Badezimmer mit Dusche und BadewanneoHeizung durch Wärmepumpe, Fußbodenheizung (Komfort &amp; Ersparnis)oPVC-Fenster mit Doppelverglasung und IsolierungoIsolierte und abgedichtete FlachdachkonstruktionoInnenausstattung nach Wunsch des KäufersINNENAUSSTATTUNG ANPASSBARErdgeschoss: oEingang mit EinbauschränkenoVoll ausgestattete Küche, offene Verbindung zum Ess-/Wohnbereich mit Zugang zum GartenoBadezimmer mit WaschmaschineoAbstellraumObergeschoss: o3 Schlafzimmer, davon eines mit AnkleideoBadezimmer mit FensteroOffener Bereich für ArbeitsplatzAUßENBEREICH &amp; PARKPLÄTZETerrasse und privater Garten nach PlanGrundausstattung und Asphaltierung durch die Verkaufsförderung vorgesehenAußensteckdose und Wasserhahn3 halbüberdachte Parkplätze im Preis pro Villa enthaltenAUSSTATTUNGoGeschäfte des täglichen Bedarfs (Bäckerei, Metzger, Apotheke, Bank usw.)oSchulen, Mediathek und lokale VereineoMedizinische und paramedizinische Dienste in der GemeindeFREIZEITAKTIVITÄTENoViele familiengerechte Wanderungen (Bisse de Ricard, Vallon de Réchy)oSchneller Zugang zu Bergaktivitäten und zum Skigebiet Vercorin (Ski, Minigolf, Kletterwald)oLokales Kulturerbe (Turm von Chalais, Bildungsbetriebe)oDörflerestaurants und -cafésVERKEHRSANBINDUNGo Seilbahn Chalais-Vercorin: Verbindet die Ebene mit dem Skigebiet in 7 Minuten.o Regionale Busse CarPostal: Bedienen Chalais und die umliegenden Orte (Sierre, Réchy, Vercorin).o Bahnhof Sierre: Erreichbar in ca. 10 Minuten mit dem Auto oder Bus, mit Direktverbindungen nach Lausanne, Genf und dem Oberwallis.o Straßenanbindung: Nähe zur Autobahnabfahrt A9 (Sierre-West), erleichtert die Fahrt mit dem Auto.Verkaufsprospekt nur auf Anfrage !Bei uns ist Neugier ein schöner Fehler, also zögern Sie nicht, uns anzurufen, um mehr Informationen zu erhalten oder einen Besuch vor Ort zu machen !Kontakt: Cyril 0794641135Alle unsere Objekte auf berra-immobilier.ch !!!","https://cdn.immoscout24.ch/t_customer_logo/logos/l_d585_v1.jpg","-","","data:image/gif;base64,R0lGODlhAQABAIAAAAAAAP///yH5BAEAAAAALAAAAAABAAEAAAIBRAA7","data:image/gif;base64,R0lGODlhAQABAIAAAAAAAP///yH5BAEAAAAALAAAAAABAAEAAAIBRAA7","","","https://media.homegate.ch/agentAvatar/a_d585_C_Bieckens_v1.jpeg","Cyril Bieckens","Agent Immobilier",""
"https://www.immoscout24.ch/kaufen/4002782763","https://cdn.immoscout24.ch/listings/v2/d585/4002782763/image/f3ef146c1104f81f7b4ab646a3b6195b.jpg","https://cdn.immoscout24.ch/listings/v2/d585/4002782763/image/f3ef146c1104f81f7b4ab646a3b6195b.jpg","","","data:image/gif;base64,R0lGODlhAQABAIAAAAAAAP///yH5BAEAAAAALAAAAAABAAEAAAIBRAA7","data:image/gif;base64,R0lGODlhAQABAIAAAAAAAP///yH5BAEAAAAALAAAAAABAAEAAAIBRAA7","","data:image/gif;base64,R0lGODlhAQABAIAAAAAAAP///yH5BAEAAAAALAAAAAABAAEAAAIBRAA7","1 / 13","https://cdn.immoscout24.ch/f_auto/t_listing_card_117x102/listings/v2/d585/4002782763/image/7de55262cd9e48f772b3e63638d0b30e.jpg","https://cdn.immoscout24.ch/f_auto/t_listing_card_117x102/listings/v2/d585/4002782763/image/3c08028e233b13f1e19cba5ba40fedfc.jpg","https://cdn.immoscout24.ch/f_auto/t_listing_card_117x102/listings/v2/d585/4002782763/image/88c590f557f9d59b7b5aa77332d86873.jpg","Parkplatz","Balkon / Terrasse","Aussicht","+3","3.5 Zimmer","83m²","CHF 485’000.–","Route de Grône 60, 3966 Réchy","Die Arbeiten haben begonnen","VERKAUF AUF PLÄNELieferung: Ende Dezember 2026Kleines Gebäude mit 7 Wohnungen auf 3 EbenenWOHNUNGSTYPEN- 1x 4,5 Zimmer- 6x 3,5 ZimmerAUSSTATTUNG DER WOHNUNG - Eingangshalle- Ausgestattete offene Küche auf die Wohnfläche- 2 Schlafzimmer- 1 Dusche mit Dusche, WC und Waschbecken- 1 Badezimmer mit Badewanne, WC und Waschbecken- Balkon von 15m2MERKMALE- Top-Lage- Bau nach den geltenden SIA-Normen- Äußere Wärmedämmung nach Energiebilanz- Wärme- und Schalldämmung- Heizung durch Luft/Wasser-Wärmepumpe- Photovoltaik-Solarpanele- Kühlmodule auf der Wärmepumpe- Fußbodenheizung- Warmwassererzeugung: Boiler verbunden mit der Wärmepumpe- 1 Elektrotableau pro Wohnung- Anschlüsse für Waschmaschinen in jeder Wohnung- Drei-Scheiben-Isolierverglasung- Schiebetüren mit Hebevorrichtung- Aufzug nach Procap-Norm- 1 Keller pro Wohnung- Ausführung nach Wunsch des Käufers- Vollständige Beschreibung auf AnfragePARKPLÄTZE- 2 Außenparkplätze zu CHF 15'000/pro Platz (zusätzlich und obligatorisch)AUSSTATTUNG- Ruhige und tranquile Lage.- Nähe zum Ortszentrum und den Geschäften- 3 Minuten mit dem Auto von der Autobahn- 5 Minuten zu Fuß von der Seilbahn und der SchuleZögern Sie nicht, die Liste der verfügbaren Grundstücke zu konsultieren.Informationen und Termin: Cyril +41 79 464 11 35***Alle unsere Immobilien sind auf www.berra-immobilier.ch verfügbar***","https://cdn.immoscout24.ch/t_customer_logo/logos/l_d585_v1.jpg","> 60 min","Station: Sierre","data:image/gif;base64,R0lGODlhAQABAIAAAAAAAP///yH5BAEAAAAALAAAAAABAAEAAAIBRAA7","data:image/gif;base64,R0lGODlhAQABAIAAAAAAAP///yH5BAEAAAAALAAAAAABAAEAAAIBRAA7","data:image/gif;base64,R0lGODlhAQABAIAAAAAAAP///yH5BAEAAAAALAAAAAABAAEAAAIBRAA7","data:image/gif;base64,R0lGODlhAQABAIAAAAAAAP///yH5BAEAAAAALAAAAAABAAEAAAIBRAA7","https://media.homegate.ch/agentAvatar/a_d585_C_Bieckens_v1.jpeg","Cyril Bieckens","Agent Immobilier","data:image/gif;base64,R0lGODlhAQABAIAAAAAAAP///yH5BAEAAAAALAAAAAABAAEAAAIBRAA7"
"https://www.immoscout24.ch/kaufen/4002782762","https://cdn.immoscout24.ch/listings/v2/d585/4002782762/image/f3ef146c1104f81f7b4ab646a3b6195b.jpg","https://cdn.immoscout24.ch/listings/v2/d585/4002782762/image/f3ef146c1104f81f7b4ab646a3b6195b.jpg","","","data:image/gif;base64,R0lGODlhAQABAIAAAAAAAP///yH5BAEAAAAALAAAAAABAAEAAAIBRAA7","data:image/gif;base64,R0lGODlhAQABAIAAAAAAAP///yH5BAEAAAAALAAAAAABAAEAAAIBRAA7","","data:image/gif;base64,R0lGODlhAQABAIAAAAAAAP///yH5BAEAAAAALAAAAAABAAEAAAIBRAA7","1 / 13","https://cdn.immoscout24.ch/f_auto/t_listing_card_117x102/listings/v2/d585/4002782762/image/7de55262cd9e48f772b3e63638d0b30e.jpg","https://cdn.immoscout24.ch/f_auto/t_listing_card_117x102/listings/v2/d585/4002782762/image/3c08028e233b13f1e19cba5ba40fedfc.jpg","https://cdn.immoscout24.ch/f_auto/t_listing_card_117x102/listings/v2/d585/4002782762/image/d1ccc7f0dcb336ff41aa6f633fce4733.jpg","Parkplatz","Balkon / Terrasse","Aussicht","+3","3.5 Zimmer","83m²","CHF 495’000.–","Route de Grône 60, 3966 Réchy","Die Arbeiten haben begonnen!","VERKAUF AUF PLÄNELieferung: Ende Dezember 2026Kleines Gebäude mit 7 Wohnungen auf 3 EbenenWOHNUNGSTYPEN- 1x 4,5 Zimmer- 6x 3,5 ZimmerAUSSTATTUNG DER WOHNUNG - Eingangshalle- Ausgestattete Küche, die zum Wohnzimmer führt- 2 Schlafzimmer- 1 Dusche mit Dusche, WC und Waschbecken- 1 Badezimmer mit Badewanne, WC und Waschbecken- Balkon von 15m2MERKMALE- Top-Lage- Bau nach den geltenden SIA-Normen- Äußere Wärmedämmung nach Energiebilanz- Wärme- und Schalldämmung- Heizung durch Luft/Wasser-Wärmepumpe- Photovoltaik-Solarmodule- Kühleinschub-Modul auf der Wärmepumpe- Fußbodenheizung- Warmwassererzeugung: Boiler, der an die Wärmepumpe angeschlossen ist- 1 Elektrotafel pro Wohnung- Anschlüsse für Waschmaschinen in jeder Wohnung- Drei-Scheiben-Isolierglas- Schiebetüren mit Hebevorrichtung- Aufzug nach Procap-Norm- 1 Keller pro Wohnung- Fertigstellung nach Wunsch des Käufers- Vollständige Beschreibung auf AnfragePARKPLÄTZE- 2 Außenparkplätze zu CHF 15'000/pro Platz (zusätzlich und obligatorisch)AUSSTATTUNG- Ruhige und friedliche Lage.- Nähe zum Ortszentrum und den Geschäften- 3 Minuten mit dem Auto von der Autobahn entfernt- 5 Minuten zu Fuß vom Seilbahn und der Schule entferntZögern Sie nicht, die Liste der verfügbaren Grundstücke zu konsultieren.Informationen und Terminvereinbarung: Cyril +41 79 464 11 35***Alle unsere Immobilien sind auf www.berra-immobilier.ch verfügbar***","https://cdn.immoscout24.ch/t_customer_logo/logos/l_d585_v1.jpg","> 60 min","Station: Sierre","data:image/gif;base64,R0lGODlhAQABAIAAAAAAAP///yH5BAEAAAAALAAAAAABAAEAAAIBRAA7","data:image/gif;base64,R0lGODlhAQABAIAAAAAAAP///yH5BAEAAAAALAAAAAABAAEAAAIBRAA7","data:image/gif;base64,R0lGODlhAQABAIAAAAAAAP///yH5BAEAAAAALAAAAAABAAEAAAIBRAA7","data:image/gif;base64,R0lGODlhAQABAIAAAAAAAP///yH5BAEAAAAALAAAAAABAAEAAAIBRAA7","https://media.homegate.ch/agentAvatar/a_d585_C_Bieckens_v1.jpeg","Cyril Bieckens","Agent Immobilier","data:image/gif;base64,R0lGODlhAQABAIAAAAAAAP///yH5BAEAAAAALAAAAAABAAEAAAIBRAA7"
"https://www.immoscout24.ch/kaufen/4002782761","https://cdn.immoscout24.ch/listings/v2/d585/4002782761/image/7de55262cd9e48f772b3e63638d0b30e.jpg","https://cdn.immoscout24.ch/listings/v2/d585/4002782761/image/7de55262cd9e48f772b3e63638d0b30e.jpg","","","data:image/gif;base64,R0lGODlhAQABAIAAAAAAAP///yH5BAEAAAAALAAAAAABAAEAAAIBRAA7","data:image/gif;base64,R0lGODlhAQABAIAAAAAAAP///yH5BAEAAAAALAAAAAABAAEAAAIBRAA7","","data:image/gif;base64,R0lGODlhAQABAIAAAAAAAP///yH5BAEAAAAALAAAAAABAAEAAAIBRAA7","1 / 13","https://cdn.immoscout24.ch/f_auto/t_listing_card_117x102/listings/v2/d585/4002782761/image/f3ef146c1104f81f7b4ab646a3b6195b.jpg","https://cdn.immoscout24.ch/f_auto/t_listing_card_117x102/listings/v2/d585/4002782761/image/f0941dbadeb4928b972983fb4aea25f2.jpg","https://cdn.immoscout24.ch/f_auto/t_listing_card_117x102/listings/v2/d585/4002782761/image/3c08028e233b13f1e19cba5ba40fedfc.jpg","Parkplatz","Balkon / Terrasse","Aussicht","+3","3.5 Zimmer","83m²","CHF 475’000.–","Route de Grône 60, 3966 Réchy","Die Arbeiten haben begonnen","VERKAUF NACH PLANLieferung: Ende Dezember 2026Kleines Gebäude mit 7 Wohnungen auf 3 EbenenWOHNUNGSTYPEN- 1x 4,5 Zimmer- 6x 3,5 ZimmerAUSSTATTUNG DER WOHNUNG - Eingangshalle- Ausgestattete offene Küche mit Wohnbereich- 2 Schlafzimmer- 1 Dusche mit Dusche, WC und Waschbecken- 1 Badezimmer mit Badewanne, WC und Waschbecken- Balkon von 15m2MERKMALE- Top-Lage- Bau nach den geltenden SIA-Normen- Äußere Wärmedämmung nach Energiebilanz- Wärme- und Schalldämmung- Heizung durch Luft/Wasser-Wärmepumpe- Photovoltaik-Solarmodule- Kühlmodule für die Wärmepumpe- Fußbodenheizung- Warmwassererzeugung: Boiler in Verbindung mit der Wärmepumpe- 1 Stromverteilerkasten pro Wohnung- Anschlüsse für Waschmaschinen in jeder Wohnung- Drei-Scheiben-Isolierglas- Schiebetüren mit Hebevorrichtung- Aufzug nach Procap-Norm- 1 Keller pro Wohnung- Ausführung nach Wunsch des Käufers- Vollständige Beschreibung auf AnfragePARKPLÄTZE- 2 Außenparkplätze zu CHF 15'000/pro Platz (zusätzlich und obligatorisch)AUSSTATTUNG- Ruhige und friedliche Lage.- Nähe zum Ortszentrum und den Geschäften- 3 Minuten mit dem Auto von der Autobahn- 5 Minuten zu Fuß von der Seilbahn und der SchuleBitte besuchen Sie die Liste der verfügbaren Objekte.Informationen und Terminvereinbarung: Cyril +41 79 464 11 35***Alle unsere Immobilien sind auf www.berra-immobilier.ch verfügbar***","https://cdn.immoscout24.ch/t_customer_logo/logos/l_d585_v1.jpg","> 60 min","Station: Sierre","data:image/gif;base64,R0lGODlhAQABAIAAAAAAAP///yH5BAEAAAAALAAAAAABAAEAAAIBRAA7","data:image/gif;base64,R0lGODlhAQABAIAAAAAAAP///yH5BAEAAAAALAAAAAABAAEAAAIBRAA7","data:image/gif;base64,R0lGODlhAQABAIAAAAAAAP///yH5BAEAAAAALAAAAAABAAEAAAIBRAA7","data:image/gif;base64,R0lGODlhAQABAIAAAAAAAP///yH5BAEAAAAALAAAAAABAAEAAAIBRAA7","https://media.homegate.ch/agentAvatar/a_d585_C_Bieckens_v1.jpeg","Cyril Bieckens","Agent Immobilier","data:image/gif;base64,R0lGODlhAQABAIAAAAAAAP///yH5BAEAAAAALAAAAAABAAEAAAIBRAA7"
"https://www.immoscout24.ch/kaufen/4002508410","https://cdn.immoscout24.ch/listings/v2/d467/4002508410/image/4a11afe7e670967aafdbe18a3789002e.jpg","https://cdn.immoscout24.ch/listings/v2/d467/4002508410/image/4a11afe7e670967aafdbe18a3789002e.jpg","","","data:image/gif;base64,R0lGODlhAQABAIAAAAAAAP///yH5BAEAAAAALAAAAAABAAEAAAIBRAA7","data:image/gif;base64,R0lGODlhAQABAIAAAAAAAP///yH5BAEAAAAALAAAAAABAAEAAAIBRAA7","","data:image/gif;base64,R0lGODlhAQABAIAAAAAAAP///yH5BAEAAAAALAAAAAABAAEAAAIBRAA7","1 / 14","https://cdn.immoscout24.ch/f_auto/t_listing_card_117x102/listings/v2/d467/4002508410/image/93af96c2b15abb7c4c3933b465e65802.jpg","https://cdn.immoscout24.ch/f_auto/t_listing_card_117x102/listings/v2/d467/4002508410/image/f113564909c3e8f6df21c3f6c0b3ab7e.jpg","https://cdn.immoscout24.ch/f_auto/t_listing_card_117x102/listings/v2/d467/4002508410/image/dbe724dcd6eb995bfd00dd67daa6d7b4.jpg","","","","","3.5 Zimmer","93m²","CHF 1’350’000.–","Chemin des Plantaz 19, 1260 Nyon","Nyon, Residenz Arboris - 3,5-Zimmer-Wohnung im Erdgeschoss mit Garten","Exklusiv - Neues Projekt ""Arboris"" in Nyon Entdecken Sie ein neues Wohnprojekt mit 19 Wohnungen, von der Studios bis zu 4,5-Zimmer-Wohnungen, ideal gelegen in einer ruhigen, grünen und idyllischen Umgebung in der Stadt Nyon. Ein einzigartiges Lebensumfeld, nur wenige Schritte von den Annehmlichkeiten und Verkehrsmitteln entfernt.Objekt Nr. 1 - Ref. 01Diese schöne 3,5-Zimmer-Wohnung bietet eine großzügige Wohnfläche von 93,05 m², ergänzt durch eine Terrasse von über 56 m², einen privaten Garten von 167,55 m² und einen Keller von 4,70 m².Die Vorzüge des Projekts Arboris: • Wohnanlage mit moderner und raffinierter Architektur • Hohe Energieeffizienz (Note B): 20 bis 30 % weniger Verbrauch im Vergleich zu einem modernen Standardbau (Note C) • Ruhige Umgebung, am Rande eines Waldes, in einer Sackgasse • Wohnungen mit verschiedenen Größen, von 32,25 m² bis 131,50 m² • Geräumige Terrassen und Balkone, von 12,90 bis 95,90 m², mit Waldblick • 14 Parkplätze im Untergeschoss verfügbar (CHF 45'000.- pro Platz, zusätzlich zum Verkaufspreis) • Bevorzugte sanfte Mobilität: Abstellraum für Fahrräder mit Ladestationen für E-Bikes Eine ideale Lage in Nyon:Das Wohnquartier Plantaz profitiert von einer bevorzugten Lage: • Nur wenige Minuten von der Bahnstation und dem Stadtzentrum entfernt • 200 Meter von den Bushaltestellen (Bel-Automne und Plantaz) • In einer ruhigen, familiären und naturnahen Umgebung Verkaufspreis: ab CHF 485'000.-Die Bauarbeiten beginnen im Frühjahr 2026 und die Fertigstellung ist für Ende 2027 geplant.Weitere Informationen finden Sie auf der Website: www.residencearboris.ch Umgebung Dieses schöne Projekt mit 19 Wohnungen, gelegen am Chemin des Plantaz 19, nur wenige Minuten von der Bahnstation und dem Stadtzentrum entfernt, bietet eine seltene Lage: in einer Sackgasse und am Rande eines Waldes, bietet es absolute Ruhe und eine friedliche, grüne Atmosphäre, während es gleichzeitig an die Annehmlichkeiten angeschlossen ist. Nur 6 Minuten mit dem Fahrrad vom Stadtzentrum Nyon entfernt, bietet die Residenz Arboris einen einfachen Zugang zu den Dienstleistungen, Geschäften und Verkehrsmitteln, während sie gleichzeitig ein bevorzugtes Umfeld bietet. Die Bushaltestellen in der Nähe ermöglichen auch einen schnellen Zugang zum Stadtzentrum und zur Bahnstation Nyon.Die neuen Bewohner können somit das Beste aus zwei Welten genießen: die Ruhe einer natürlichen, friedlichen Umgebung und die Dynamik einer ambitionierten und attraktiven Stadt, die kulturell und vernetzt ist!Die Bushaltestellen befinden sich 3 Minuten zu Fuß (ca. 200 m) von der Residenz Arboris (Bushaltestellen Bel-Automne und Les Plantaz).Der Bahnhof Nyon-St-Cergue-La Cure, gelegen bei den Plantaz, befindet sich etwa 10 Minuten zu Fuß entfernt. Dann benötigt man 2 Minuten mit dem Zug, um den Bahnhof Nyon und das Stadtzentrum zu erreichen.","https://cdn.immoscout24.ch/logos/l_d467_eb89582a-5922-4ec2-ac3a-ea0eefffea21.png","7 min.","Station: Les Plantaz","data:image/gif;base64,R0lGODlhAQABAIAAAAAAAP///yH5BAEAAAAALAAAAAABAAEAAAIBRAA7","data:image/gif;base64,R0lGODlhAQABAIAAAAAAAP///yH5BAEAAAAALAAAAAABAAEAAAIBRAA7","data:image/gif;base64,R0lGODlhAQABAIAAAAAAAP///yH5BAEAAAAALAAAAAABAAEAAAIBRAA7","data:image/gif;base64,R0lGODlhAQABAIAAAAAAAP///yH5BAEAAAAALAAAAAABAAEAAAIBRAA7","https://media2.homegate.ch/agent-avatars/d467_ec0f9e0f-175f-4af9-b5e8-f5b120aa6a78.jpg","Vincent Buccino","Courtier en immobilier – Responsable agence de Nyon","data:image/gif;base64,R0lGODlhAQABAIAAAAAAAP///yH5BAEAAAAALAAAAAABAAEAAAIBRAA7"
