"HgCardElevated_content_900d9 href","HgListingCardImages_mainImage_31980 src","HgListingCardImages_mainImage_31980 src 2","HgListingCardImages_mainImage_31980 src 7","HgListingCardImages_mainImage_31980 src 8","HgSlider_splideSlideCenter_68051 src 6","HgSlider_splideSlideCenter_68051 src 7","HgListingCardImages_mainImage_31980 src 9","HgSlider_splideSlideCenter_68051 src 10","SlidesCounter_slidesCounter_7c328","HgListingCardImages_thumbnail_276b9 src","HgListingCardImages_thumbnail_276b9 src 2","HgListingCardImages_thumbnail_276b9 src 3","HgListingCardFeatures_tag_f054d","HgListingCardFeatures_tag_f054d 2","HgListingCardFeatures_tag_f054d 3","HgListingCardFeatures_tag_f054d 4","HgListingRoomsLivingSpacePrice_roomsLivingSpacePrice_ab258","HgListingRoomsLivingSpacePrice_roomsLivingSpacePrice_ab258 3","HgListingRoomsLivingSpacePrice_price_ad2cb","HgListingCard_address_3884e","HgListingDescription_title_fa343","HgListingDescription_extra-large_6c28d","HgListingCard_logo_a4d84 src","ListingTravelTime_travelTimeDuration_6ed93","ListingTravelTime_travelTimePOI_e9883","HgSlider_splideSlideCenter_68051 src 11","HgSlider_splideSlideCenter_68051 src 12","HgSlider_splideSlideCenter_68051 src 13","HgSlider_splideSlideCenter_68051 src 14","HgListingCardAgent_agentImageContainer_8e1f3 src","HgListingCardAgent_agentInfo_481a2","HgListingCardAgent_agentInfo_481a2 2","HgSlider_splideSlideCenter_68051 src 15"
"https://www.immoscout24.ch/kaufen/4002948543","https://cdn.immoscout24.ch/listings/v2/h267/4002948543/image/02f8465eec84e1fbdc287777f70e2ca0.jpg","https://cdn.immoscout24.ch/listings/v2/h267/4002948543/image/1517704ab12cd85ad3e90e00417acf54.jpg","https://cdn.immoscout24.ch/listings/v2/h267/4002948543/image/8a1870abbd3e822db36a8c9d1c2a5601.jpg","https://cdn.immoscout24.ch/listings/v2/h267/4002948543/image/b5882ef8a392383c2851b244d978ddd6.jpg","data:image/gif;base64,R0lGODlhAQABAIAAAAAAAP///yH5BAEAAAAALAAAAAABAAEAAAIBRAA7","data:image/gif;base64,R0lGODlhAQABAIAAAAAAAP///yH5BAEAAAAALAAAAAABAAEAAAIBRAA7","https://cdn.immoscout24.ch/listings/v2/h267/4002948543/image/02f8465eec84e1fbdc287777f70e2ca0.jpg","data:image/gif;base64,R0lGODlhAQABAIAAAAAAAP///yH5BAEAAAAALAAAAAABAAEAAAIBRAA7","8 / 15","https://cdn.immoscout24.ch/f_auto/t_listing_card_117x102/listings/v2/h267/4002948543/image/1517704ab12cd85ad3e90e00417acf54.jpg","https://cdn.immoscout24.ch/f_auto/t_listing_card_117x102/listings/v2/h267/4002948543/image/9dc6757be2b112b630d3cd3623eec836.jpg","https://cdn.immoscout24.ch/f_auto/t_listing_card_117x102/listings/v2/h267/4002948543/image/29a07bc7190396fee3a5f3d0b7f7c35d.jpg","Balkon / Terrasse","Garage","Lift","+4","4.5 Zimmer","113m²","CHF 880’000.–","Ziegeleistrasse 4, 8572 Berg TG","Privilegiert wohnen im Grünen - direkt angrenzend an die Landwirtschaft im Ziegelei-Quartier (D 1.1)","Hochwertige Überbauung mit eigenständigem Charakter Eingebettet in Berg (TG) entsteht das erstklassige Neubauprojekt «Ziegelei Quartier» mit insgesamt über 200 Wohneinheiten an 2.5- bis 5.5-Zimmerwohnungen, welche mit Nachhaltigkeit und Eleganz bestechen.Mit modernen und lichtdurchfluteten Wohnräumen, zeitgemässer Haustechnik sowie einem hochwertigen Ausbaustandard bieten die Wohnungen optimale Voraussetzungen, um Ihren Wohntraum zu erfüllen. Die moderne, hochwertige Architektur und die energieeffiziente Bauweise mit Zweischalenmauerwerk unterstreichen das Konzept von nachhaltigem und zeitgemässem Wohnen.Dank verschiedener Grundrisstypen lässt sich hier fast jede Einrichtungsidee umsetzen. Alle Wohnungen überzeugen zudem mit Aussenflächen und eigenem Park und bieten die beste Aussicht für Ihre Zukunft.Geniessen Sie folgenden Komfort der 4.5-Zimmewohnung:-Funktioneller, durchdachter Grundriss-Hochwertig und modern ausgestattete Küche-Offener, heller Wohn- und Essbereich-Zwei elegante Badezimmer-Grosser, gedeckter Balkon (27.6 m²)Entdecken Sie weitere Grundrisse und Wohnungsgrössen auf der Projektwebsite.Vorzüge der Lage:-Ruhige Umgebung und grosser Park-Breitgefächerte Auswahl an Einkaufsmöglichkeiten, Dienstleister sowie Kultur- und Freizeitangebote in der Umgebung-Gute Anbindungen an den öffentlichen sowie privaten VerkehrIhr Interesse wurde geweckt?Wir freuen uns auf Ihre Kontaktanfrage und stehen für Auskünfte gerne zur Verfügung.","https://cdn.immoscout24.ch/t_customer_logo/logos/l_h267_v1.png","10 min.","Station: Berg","","","","","","","",""
"https://www.immoscout24.ch/kaufen/4002842155","","","https://cdn.immoscout24.ch/listings/v2/s048/4002842155/image/ad1dfe9fb799911056f426d78c789ae7.jpg","https://cdn.immoscout24.ch/listings/v2/s048/4002842155/image/17a69da0798312c8f83be3bb8a170b89.jpg","data:image/gif;base64,R0lGODlhAQABAIAAAAAAAP///yH5BAEAAAAALAAAAAABAAEAAAIBRAA7","data:image/gif;base64,R0lGODlhAQABAIAAAAAAAP///yH5BAEAAAAALAAAAAABAAEAAAIBRAA7","https://cdn.immoscout24.ch/listings/v2/s048/4002842155/image/ad1dfe9fb799911056f426d78c789ae7.jpg","data:image/gif;base64,R0lGODlhAQABAIAAAAAAAP///yH5BAEAAAAALAAAAAABAAEAAAIBRAA7","2 / 13","https://cdn.immoscout24.ch/f_auto/t_listing_card_117x102/listings/v2/s048/4002842155/image/17a69da0798312c8f83be3bb8a170b89.jpg","https://cdn.immoscout24.ch/f_auto/t_listing_card_117x102/listings/v2/s048/4002842155/image/abe897c95de6e5c954b44535adfbfe36.jpg","https://cdn.immoscout24.ch/f_auto/t_listing_card_117x102/listings/v2/s048/4002842155/image/66329ca52d33dd7a938e81051d43b076.jpg","Parkplatz","Balkon / Terrasse","Garage","+2","4.5 Zimmer","108m²","CHF 765’000.–","Spiezstrasse 59, 3645 Gwatt","Neubauprojekt Gwattmoos: 4½-Zimmerwohnung im 1. OG","Das gesamte Wohnungsangebot finden Sie auf unserer Webseite www.casa-immo.chIm Gwatt bei Thun, eingebettet zwischen dem glitzernden Thunersee und den eindrucksvollen Alpen, entsteht ein neues Wohn- und Gewerbeensemble, das urbanes Leben mit naturnaher Qualität verbindet. Zwei moderne Häuser entlang der Hauptstrasse fügen sich harmonisch ins Ortsbild ein und bieten Raum für zeitgemässes Wohnen und Arbeiten.Im Erdgeschoss entstehen attraktive Gewerbeflächen, die flexibel genutzt werden können - ob für Dienstleister, kleine Läden oder innovative Büros. Darüber verteilen sich mehrere Wohnungen in unterschiedlichen Grössen, die mit durchdachten Grundrissen, lichtdurchfluteten Räumen und einem hochwertigen Ausbaustandard überzeugen.Einige der Wohnungen bieten wunderbare Ausblicke über das Gwatt­lischenmoss hin zum See oder auf die umliegende Bergwelt. Gleichzeitig profitieren Bewohnerinnen und Bewohner von der Nähe zur Stadt Thun mit ihrem vielfältigen Angebot an Kultur, Gastronomie und Einkaufsmöglichkeiten.Auch in puncto Nachhaltigkeit setzt das Projekt Massstäbe: Die Wärmeversorgung erfolgt über eine moderne Wärmepumpe, während eine Photovoltaikanlage erneuerbare Energie direkt vor Ort produziert. Ein Doppelschalenmauerwerk sorgt für optimale Dämmung, Energieeffizienz und ein angenehmes Raumklima - Sommer wie Winter. So vereint die Architektur nicht nur ästhetische Ansprüche, sondern auch ökologische Verantwortung.Mit dem Neubau Gwattmoos entsteht ein Projekt, das den Spagat zwischen Lebensqualität am See, guter Anbindung an die Stadt und funktionaler Architektur vereint - ein neuer Ort zum Wohnen, Arbeiten und Wohlfühlen.Das gesamte Angebot der Überbauung ""Gwattmoos"" finden Sie auf unserer Webseite www.casa-immo.ch/gwattmoosNicht die passende Immobilie gefunden? Wir unterstützen Sie bei der Suche: Mit unserem personalisierten Newsletter bleiben Sie auf dem Laufenden. Der Suchauftrag ist unverbindlich und kostenlos. Ihre Angaben werden vertraulich behandelt und nicht an Dritte weitergegeben. www.casa-immo.ch/suchkunden","https://cdn.immoscout24.ch/logos/l_s048_912c5757-491e-4dd2-913e-3e74c1af328e.png","56 min.","Station: Lattigen","data:image/gif;base64,R0lGODlhAQABAIAAAAAAAP///yH5BAEAAAAALAAAAAABAAEAAAIBRAA7","data:image/gif;base64,R0lGODlhAQABAIAAAAAAAP///yH5BAEAAAAALAAAAAABAAEAAAIBRAA7","data:image/gif;base64,R0lGODlhAQABAIAAAAAAAP///yH5BAEAAAAALAAAAAABAAEAAAIBRAA7","data:image/gif;base64,R0lGODlhAQABAIAAAAAAAP///yH5BAEAAAAALAAAAAABAAEAAAIBRAA7","https://media2.homegate.ch/agent-avatars/s048_a5ebaa0b-beac-4ed8-9b63-96e6acaf0d99.jpg","Gioacchino Calà","Beratung und Verkauf",""
"https://www.immoscout24.ch/kaufen/4002783416","https://cdn.immoscout24.ch/listings/v2/d585/4002783416/image/d4867f61449a69ee37a0e09ed80dab6a.jpg","https://cdn.immoscout24.ch/listings/v2/d585/4002783416/image/9065556dfece6e1efca358865d56e435.jpg","https://cdn.immoscout24.ch/listings/v2/d585/4002783416/image/57db089b5dafe9ab8457d8cffbb26e07.jpg","https://cdn.immoscout24.ch/listings/v2/d585/4002783416/image/12cd801beaa97d78a84da623caf837ac.jpg","","","https://cdn.immoscout24.ch/listings/v2/d585/4002783416/image/d4867f61449a69ee37a0e09ed80dab6a.jpg","data:image/gif;base64,R0lGODlhAQABAIAAAAAAAP///yH5BAEAAAAALAAAAAABAAEAAAIBRAA7","10 / 13","https://cdn.immoscout24.ch/f_auto/t_listing_card_117x102/listings/v2/d585/4002783416/image/9065556dfece6e1efca358865d56e435.jpg","https://cdn.immoscout24.ch/f_auto/t_listing_card_117x102/listings/v2/d585/4002783416/image/9bce2eef55743756933eaee2888a224a.jpg","https://cdn.immoscout24.ch/f_auto/t_listing_card_117x102/listings/v2/d585/4002783416/image/0a458a6e71a61075238a1c1d6edce0ba.jpg","Parkplatz","Garage","Aussicht","","5.5 Zimmer","160m²","CHF 825’000.–","Route de Chippis 46, 3966 Chalais","Die Arbeiten haben begonnen","Die Arbeiten haben begonnenNeue Promotion in Chalais !Verkauf nach Plan Bau von 11 contemporary Villen mit 160m23 einzelne Villen mit 5,5 Zimmern8 halb-individuelle Villen mit 5,5 Zimmern Einzelner Technikraum KellerZufahrtGroße Gärten2 Schritte vom Manor de Sierre entferntSchöne Lage in der Nähe von Geschäften und Autobahnen in einer angenehmen Umgebung mit verschiedenen Orientierungen und Aussichten.Diese halb-individuelle Villa D auf 2 Etagen mit einer Wohnfläche von 160 m2 besteht aus:EG:- Eingangshalle mit Einbauschränken- Waschküche- Badezimmer mit WC, Dusche, Waschbecken und Fenster- Ein Schlafzimmer- Ausgestattete Küche mit offener Verbindung zum Esszimmer/Wohnzimmer mit Zugang zur Südterrasse und großem GartenOG:- Elternschlafzimmer mit Ankleide und eigenem Badezimmer: italienische Dusche, Doppelwaschbecken, WC und Fenster- 2 weitere Schlafzimmer- 1 Badezimmer mit Badewanne, WC, Waschbecken und FensterEin Keller und ein einzelner Technikraum gehören zu dieser Villa.PARKPLATZ:- 1 überdachter Stellplatz für ein Auto- 2 AußenparkplätzeEIGENSCHAFTEN:- Bauweise mit contemporary Architektur und reduziertem Design- Flachdach und Peripherieverkleidung- Photovoltaikpanele- Fußbodenheizung, Wärmepumpe Luft-Wasser, Niedertemperatur- Überdachter Stellplatz für ein Auto- Ausstattung nach Wunsch des Käufers und innerhalb des zugewiesenen BudgetsVERFÜGBARKEITEN:- Bushaltestelle direkt vor der Residenz- Seilbahn Chalais-Vercorin- Schule in Chalais- Kinderkrippe-UAPE- Geschäfte- Autobahn und Sierre- 2 Schritte vom Manor de Sierre und all seinen Verfügbarkheiten entferntVerkaufsprospekt nur auf Anfrage !Bei uns ist Neugier ein schöner Fehler, also zögern Sie nicht, uns anzurufen, um mehr Informationen zu erhalten oder einen Besuch vor Ort zu machen !Kontakt: Cyril 0794641135***Alle verfügbaren Lose auf www.berra-immobilier.ch!!!!*","https://cdn.immoscout24.ch/t_customer_logo/logos/l_d585_v1.jpg","47 min.","Station: Sierre","","","","","https://media.homegate.ch/agentAvatar/a_d585_C_Bieckens_v1.jpeg","Cyril Bieckens","Agent Immobilier",""
"https://www.immoscout24.ch/kaufen/4002783415","https://cdn.immoscout24.ch/listings/v2/d585/4002783415/image/9065556dfece6e1efca358865d56e435.jpg","https://cdn.immoscout24.ch/listings/v2/d585/4002783415/image/9065556dfece6e1efca358865d56e435.jpg","","","data:image/gif;base64,R0lGODlhAQABAIAAAAAAAP///yH5BAEAAAAALAAAAAABAAEAAAIBRAA7","data:image/gif;base64,R0lGODlhAQABAIAAAAAAAP///yH5BAEAAAAALAAAAAABAAEAAAIBRAA7","","data:image/gif;base64,R0lGODlhAQABAIAAAAAAAP///yH5BAEAAAAALAAAAAABAAEAAAIBRAA7","1 / 13","https://cdn.immoscout24.ch/f_auto/t_listing_card_117x102/listings/v2/d585/4002783415/image/7ad9239ce4268e633fff6e2c1afaf024.jpg","https://cdn.immoscout24.ch/f_auto/t_listing_card_117x102/listings/v2/d585/4002783415/image/d4867f61449a69ee37a0e09ed80dab6a.jpg","https://cdn.immoscout24.ch/f_auto/t_listing_card_117x102/listings/v2/d585/4002783415/image/9bce2eef55743756933eaee2888a224a.jpg","Parkplatz","Garage","Aussicht","","5.5 Zimmer","160m²","CHF 825’000.–","Route de Chippis 46, 3966 Chalais","Die Arbeiten haben begonnen","Die Arbeiten haben begonnenNeue Promotion in Chalais !Verkauf nach Plan Bau von 11 contemporary Villen mit 160m23 einzelne Villen mit 5,5 Zimmern8 halb-individuelle Villen mit 5,5 Zimmern Einzelner Technikraum KellerZufahrtswegGroße GärtenSchöne Lage in der Nähe von Geschäften und Autobahnen in einer angenehmen Umgebung mit verschiedenen Orientierungen und Aussichten.Diese halb-individuelle Villa F auf 2 Etagen mit einer Wohnfläche von 160 m2 besteht aus:EG:- Eingangshalle mit Einbauschränken- Waschküche- Badezimmer mit WC, Dusche, Waschbecken und Fenster- Ein Schlafzimmer- Ausgestattete Küche mit offener Verbindung zum Esszimmer/Wohnzimmer mit Zugang zur Terrasse und großem GartenOG:- Elternschlafzimmer mit Ankleide und eigenem Badezimmer: italienische Dusche, Doppelwaschbecken, WC und Fenster- 2 zusätzliche Schlafzimmer- 1 Badezimmer mit Badewanne, WC, Waschbecken und FensterEin Keller begleitet diese Villa sowie ein einzelner Technikraum.PARKPLATZ:- 1 überdachter Stellplatz für ein Auto- 2 AußenparkplätzeMERKMALE:- Bauwerk mit contemporary Architektur und reduziertem Design- Flachdach und Peripherieverkleidung- Photovoltaikpanele- Fußbodenheizung, Wärmepumpe Luft-Wasser, Niedertemperatur- Überdachter Stellplatz für ein Auto- Ausführung nach Wunsch des Käufers und nach den zugewiesenen BudgetsVERKEHRSANBINDUNG:- Bushaltestelle direkt gegenüber der Residenz- Seilbahn Chalais-Vercorin- Schulzentrum Chalais- Kinderkrippe-UAPE- Geschäfte- Autobahn und SierreVerkaufsprospekt nur auf Anfrage !Bei uns ist Neugier ein schöner Fehler, also zögern Sie nicht, uns anzurufen, um mehr Informationen zu erhalten oder einen Besuch vor Ort zu machen !Kontakt: Cyril 0794641135***Alle verfügbaren Grundstücke auf www.berra-immobilier.ch !!!!***","https://cdn.immoscout24.ch/t_customer_logo/logos/l_d585_v1.jpg","47 min.","Station: Sierre","data:image/gif;base64,R0lGODlhAQABAIAAAAAAAP///yH5BAEAAAAALAAAAAABAAEAAAIBRAA7","data:image/gif;base64,R0lGODlhAQABAIAAAAAAAP///yH5BAEAAAAALAAAAAABAAEAAAIBRAA7","data:image/gif;base64,R0lGODlhAQABAIAAAAAAAP///yH5BAEAAAAALAAAAAABAAEAAAIBRAA7","data:image/gif;base64,R0lGODlhAQABAIAAAAAAAP///yH5BAEAAAAALAAAAAABAAEAAAIBRAA7","https://media.homegate.ch/agentAvatar/a_d585_C_Bieckens_v1.jpeg","Cyril Bieckens","Agent Immobilier","data:image/gif;base64,R0lGODlhAQABAIAAAAAAAP///yH5BAEAAAAALAAAAAABAAEAAAIBRAA7"
"https://www.immoscout24.ch/kaufen/4002783414","https://cdn.immoscout24.ch/listings/v2/d585/4002783414/image/0a458a6e71a61075238a1c1d6edce0ba.jpg","https://cdn.immoscout24.ch/listings/v2/d585/4002783414/image/0a458a6e71a61075238a1c1d6edce0ba.jpg","","","data:image/gif;base64,R0lGODlhAQABAIAAAAAAAP///yH5BAEAAAAALAAAAAABAAEAAAIBRAA7","data:image/gif;base64,R0lGODlhAQABAIAAAAAAAP///yH5BAEAAAAALAAAAAABAAEAAAIBRAA7","","data:image/gif;base64,R0lGODlhAQABAIAAAAAAAP///yH5BAEAAAAALAAAAAABAAEAAAIBRAA7","1 / 13","https://cdn.immoscout24.ch/f_auto/t_listing_card_117x102/listings/v2/d585/4002783414/image/9065556dfece6e1efca358865d56e435.jpg","https://cdn.immoscout24.ch/f_auto/t_listing_card_117x102/listings/v2/d585/4002783414/image/95f2cb788d8e93e4a3237c342cdc4137.jpg","https://cdn.immoscout24.ch/f_auto/t_listing_card_117x102/listings/v2/d585/4002783414/image/c33890c20dd1ee0bb5e0ec051881b71e.jpg","Parkplatz","Garage","Aussicht","","5.5 Zimmer","160m²","CHF 825’000.–","Route de Chippis 46, 3966 Chalais","Die Arbeiten sind im Gange!","Neue Promotion in Chalais!Verkauf nach PlanBau von 11 contemporary Villen mit 160m23 einzelne Villen mit 5,5 Zimmern8 halb-individuelle Villen mit 5,5 Zimmern Einzelner Technikraum KellerZufahrtswegGroße GärtenSchöne Lage in der Nähe von Einrichtungen und Autobahnen in einer angenehmen Umgebung mit verschiedenen Orientierungen und Aussichten.Diese halb-individuelle Villa G auf 2 Etagen mit einer Wohnfläche von 160 m2 besteht aus:EG:- Eingangshalle mit Einbauschränken- Waschküche- Badezimmer mit WC, Dusche, Waschbecken und Fenster- Ein Schlafzimmer- Ausgestattete Küche mit offener Verbindung zum Esszimmer/Wohnzimmer mit Zugang zur Süd-Terrasse und großem GartenObergeschoss:- Elternschlafzimmer mit Ankleide und eigenem Badezimmer: italienische Dusche, Doppelwaschbecken, WC und Fenster- 2 weitere Schlafzimmer- 1 Badezimmer mit Badewanne, WC, Waschbecken und FensterEin Keller begleitet diese Villa sowie ein einzelner Technikraum.PARKPLATZ:- 1 überdachter Stellplatz für ein Auto- 2 AußenparkplätzeMERKMALE:- Bau mit contemporary Architektur und reduziertem Design- Flachdach und Peripherieverkleidung- Photovoltaik-Panel- Fußbodenheizung, Wärmepumpe Luft-Wasser, Niedertemperatur- Überdachter Stellplatz für ein Auto- Ausführung nach Wunsch des Käufers und nach budgetierten MittelnEINRICHTUNGEN:- Bushaltestelle direkt gegenüber der Residenz- Seilbahn Chalais-Vercorin- Schule in Chalais- Kinderkrippe-UAPE- Geschäfte- Autobahn und SierreVerkaufsprospekt nur auf Anfrage!Bei uns ist Neugier ein schöner Fehler, also zögern Sie nicht, uns anzurufen, um mehr Informationen zu erhalten oder einen Besuch vor Ort zu machen!Kontakt: Cyril 0794641135***Alle verfügbaren Angebote auf www.berra-immobilier.ch!!!!*","https://cdn.immoscout24.ch/t_customer_logo/logos/l_d585_v1.jpg","47 min.","Station: Sierre","data:image/gif;base64,R0lGODlhAQABAIAAAAAAAP///yH5BAEAAAAALAAAAAABAAEAAAIBRAA7","data:image/gif;base64,R0lGODlhAQABAIAAAAAAAP///yH5BAEAAAAALAAAAAABAAEAAAIBRAA7","data:image/gif;base64,R0lGODlhAQABAIAAAAAAAP///yH5BAEAAAAALAAAAAABAAEAAAIBRAA7","data:image/gif;base64,R0lGODlhAQABAIAAAAAAAP///yH5BAEAAAAALAAAAAABAAEAAAIBRAA7","https://media.homegate.ch/agentAvatar/a_d585_C_Bieckens_v1.jpeg","Cyril Bieckens","Agent Immobilier","data:image/gif;base64,R0lGODlhAQABAIAAAAAAAP///yH5BAEAAAAALAAAAAABAAEAAAIBRAA7"
"https://www.immoscout24.ch/kaufen/4002783413","https://cdn.immoscout24.ch/listings/v2/d585/4002783413/image/9dd067543d06cf2a4cb5d4b6a9db3ae3.jpg","https://cdn.immoscout24.ch/listings/v2/d585/4002783413/image/0a458a6e71a61075238a1c1d6edce0ba.jpg","https://cdn.immoscout24.ch/listings/v2/d585/4002783413/image/9bce2eef55743756933eaee2888a224a.jpg","https://cdn.immoscout24.ch/listings/v2/d585/4002783413/image/c275f2a8a129a964cbfb7ce4250948f1.jpg","data:image/gif;base64,R0lGODlhAQABAIAAAAAAAP///yH5BAEAAAAALAAAAAABAAEAAAIBRAA7","data:image/gif;base64,R0lGODlhAQABAIAAAAAAAP///yH5BAEAAAAALAAAAAABAAEAAAIBRAA7","https://cdn.immoscout24.ch/listings/v2/d585/4002783413/image/9dd067543d06cf2a4cb5d4b6a9db3ae3.jpg","data:image/gif;base64,R0lGODlhAQABAIAAAAAAAP///yH5BAEAAAAALAAAAAABAAEAAAIBRAA7","5 / 13","https://cdn.immoscout24.ch/f_auto/t_listing_card_117x102/listings/v2/d585/4002783413/image/0a458a6e71a61075238a1c1d6edce0ba.jpg","https://cdn.immoscout24.ch/f_auto/t_listing_card_117x102/listings/v2/d585/4002783413/image/9065556dfece6e1efca358865d56e435.jpg","https://cdn.immoscout24.ch/f_auto/t_listing_card_117x102/listings/v2/d585/4002783413/image/9bce2eef55743756933eaee2888a224a.jpg","Parkplatz","Garage","Aussicht","","5.5 Zimmer","160m²","CHF 825’000.–","Route de Chippis 46, 3966 Chalais","Baustelle in Arbeit!","Neue Promotion in Chalais!Verkauf nach PlanBau von 11 contemporary Villen mit 160m23 einzelne Villen mit 5,5 Zimmern8 halb-individuelle Villen mit 5,5 Zimmern Einzelner Technikraum KellerZufahrtsstraßeGroße GärtenSchöne Lage in der Nähe von Geschäften und Autobahnen in einer angenehmen Umgebung mit verschiedenen Orientierungen und Aussichten.Diese halb-individuelle Villa H über 2 Etagen mit einer Wohnfläche von 160 m2 besteht aus:EG:- Eingangshalle mit Einbauschränken- Waschküche- Badezimmer mit WC, Dusche, Waschbecken und Fenster- Ein Schlafzimmer- Ausgestattete Küche mit offener Verbindung zum Esszimmer/Wohnzimmer mit Zugang zur Terrasse West und großem GartenOG:- Elternschlafzimmer mit Ankleide und eigenem Badezimmer: italienische Dusche, Doppelwaschbecken, WC und Fenster- 2 zusätzliche Schlafzimmer- 1 Badezimmer mit Badewanne, WC, Waschbecken und FensterEin Keller begleitet diese Villa sowie ein einzelner Technikraum.PARKPLATZ:- 1 überdachter Stellplatz für ein Auto- 2 AußenparkplätzeEIGENSCHAFTEN:- Bauweise mit contemporary Architektur und reduziertem Design- Flachdach und Peripherieverkleidung- Photovoltaikpanele- Fußbodenheizung, Wärmepumpe Luft-Wasser, Niedertemperatur- Überdachter Stellplatz für ein Auto- Ausführung nach Wunsch des Käufers und nach budgetierten MittelnVERKEHRSANBINDUNG:- Bushaltestelle direkt gegenüber der Residenz- Seilbahn Chalais-Vercorin- Schulzentrum Chalais- Kinderkrippe-UAPE- Geschäfte- Autobahn und SierreVerkaufsprospekt nur auf Anfrage!Bei uns ist Neugier ein schöner Fehler, also zögern Sie nicht, uns anzurufen, um mehr Informationen zu erhalten oder einen Besuch vor Ort zu machen!Kontakt: Cyril 0794641135***Alle verfügbaren Einheiten auf www.berra-immobilier.ch!!!!*","https://cdn.immoscout24.ch/t_customer_logo/logos/l_d585_v1.jpg","47 min.","Station: Sierre","data:image/gif;base64,R0lGODlhAQABAIAAAAAAAP///yH5BAEAAAAALAAAAAABAAEAAAIBRAA7","","","","https://media.homegate.ch/agentAvatar/a_d585_C_Bieckens_v1.jpeg","Cyril Bieckens","Agent Immobilier",""
"https://www.immoscout24.ch/kaufen/4002783411","https://cdn.immoscout24.ch/listings/v2/d585/4002783411/image/9065556dfece6e1efca358865d56e435.jpg","https://cdn.immoscout24.ch/listings/v2/d585/4002783411/image/9065556dfece6e1efca358865d56e435.jpg","","","data:image/gif;base64,R0lGODlhAQABAIAAAAAAAP///yH5BAEAAAAALAAAAAABAAEAAAIBRAA7","data:image/gif;base64,R0lGODlhAQABAIAAAAAAAP///yH5BAEAAAAALAAAAAABAAEAAAIBRAA7","","data:image/gif;base64,R0lGODlhAQABAIAAAAAAAP///yH5BAEAAAAALAAAAAABAAEAAAIBRAA7","1 / 13","https://cdn.immoscout24.ch/f_auto/t_listing_card_117x102/listings/v2/d585/4002783411/image/c275f2a8a129a964cbfb7ce4250948f1.jpg","https://cdn.immoscout24.ch/f_auto/t_listing_card_117x102/listings/v2/d585/4002783411/image/0a458a6e71a61075238a1c1d6edce0ba.jpg","https://cdn.immoscout24.ch/f_auto/t_listing_card_117x102/listings/v2/d585/4002783411/image/9bce2eef55743756933eaee2888a224a.jpg","Parkplatz","Garage","Aussicht","","5.5 Zimmer","160m²","CHF 825’000.–","Route de Chippis 46, 3966 Chalais","Die Arbeiten haben begonnen","Die Arbeiten haben begonnenNeue Promotion in Chalais !Verkauf nach Plan Bau von 11 contemporary Villen mit 160m23 einzelne Villen mit 5,5 Zimmern8 halb-individuelle Villen mit 5,5 Zimmern Einzelner Technikraum KellerZufahrtsstraßeGroße GärtenSchöne Lage in der Nähe von Geschäften und Autobahnen in einer angenehmen Umgebung mit verschiedenen Orientierungen und Aussichten.Diese halb-individuelle Villa J auf 2 Etagen mit einer Wohnfläche von 160 m2 besteht aus:EG:- Eingangshalle mit Einbauschränken- Waschküche- Badezimmer mit WC, Dusche, Waschbecken und Fenster- Ein Schlafzimmer- Ausgestattete Küche mit offener Verbindung zum Esszimmer/Wohnzimmer mit Zugang zur Terrasse West und großem GartenOG:- Elternschlafzimmer mit Ankleide und eigenem Badezimmer: italienische Dusche, Doppelwaschbecken, WC und Fenster- 2 weitere Schlafzimmer- 1 Badezimmer mit Badewanne, WC, Waschbecken und FensterEin Keller begleitet diese Villa sowie ein einzelner Technikraum.PARKPLATZ:- 1 überdachter Stellplatz für ein Auto- 2 AußenparkplätzeEIGENSCHAFTEN:- Bauweise mit contemporary Architektur und reduziertem Design- Flachdach und Peripherieverkleidung- Photovoltaikpanele- Fußbodenheizung, Wärmepumpe Luft-Wasser, Niedertemperatur- Überdachter Stellplatz für ein Auto- Ausführung nach Wunsch des Käufers und nach BudgetVERKEHRSANBINDUNG:- Bushaltestelle direkt gegenüber der Residenz- Seilbahn Chalais-Vercorin- Schulzentrum Chalais- Kinderkrippe-UAPE- Geschäfte- Autobahn und SierreVerkaufsprospekt nur auf Anfrage !Bei uns ist Neugier ein schöner Fehler, also zögern Sie nicht, uns anzurufen, um mehr Informationen zu erhalten oder einen Besuch vor Ort zu machen !Kontakt: Cyril 0794641135***Alle verfügbaren Angebote auf www.berra-immobilier.ch!!!!!","https://cdn.immoscout24.ch/t_customer_logo/logos/l_d585_v1.jpg","47 min.","Station: Sierre","data:image/gif;base64,R0lGODlhAQABAIAAAAAAAP///yH5BAEAAAAALAAAAAABAAEAAAIBRAA7","data:image/gif;base64,R0lGODlhAQABAIAAAAAAAP///yH5BAEAAAAALAAAAAABAAEAAAIBRAA7","data:image/gif;base64,R0lGODlhAQABAIAAAAAAAP///yH5BAEAAAAALAAAAAABAAEAAAIBRAA7","data:image/gif;base64,R0lGODlhAQABAIAAAAAAAP///yH5BAEAAAAALAAAAAABAAEAAAIBRAA7","https://media.homegate.ch/agentAvatar/a_d585_C_Bieckens_v1.jpeg","Cyril Bieckens","Agent Immobilier","data:image/gif;base64,R0lGODlhAQABAIAAAAAAAP///yH5BAEAAAAALAAAAAABAAEAAAIBRAA7"
